{"schema_version":"1.0","scenario":"personnel_incentive","settlement":{"source_file":"郑州雨瑶5.1-5.20人员激励活动结算单.jpg","customer_name":"郑州雨瑶化妆品有限公司","activity_start":"2026-05-01","activity_end":"2026-05-20","claimed_amount":7350,"declared_total_quantity":2451,"declared_total_reward":7353,"seal_visible":true,"signed_date":"2026-05-22","notes":["文件可见标题为“市场费用结算单”，项目为“市场费用（人员激励）”；右上角“编号：”后未见填写内容。","正文载明郑州雨瑶化妆品有限公司于2026年5月1号至2026年5月20号开展活动，表内活动时间为2026.5.1-2026.5.20。","“合计”行可见销售数量2451、奖励单价3、奖励金额7353；另行可见“实际核销金额：7350”。本次仅提取，不计算最终支持金额。","红色圆形印章可见并覆盖客户名称/日期区域的一部分；客户名称仍可读为郑州雨瑶化妆品有限公司，日期仍可读为2026-5-22。可见印章不等同于真实性或数字签名验证。","用途备注可见：核销的费用只能用作货补下单，若双方终止合作，剩余未使用费用将清零。","10条奖励单品均未打印条码；依据规则只作中等置信度的一对一Excel条码映射。"],"lines":[{"line_no":1,"product_name":"羟基磷灰石修复牙膏","quantity":238,"unit_reward":3,"reward_amount":714,"sales_match":{"barcode":"6970356166832","excel_product_name":"参半羟基磷灰石牙膏100g满陇桂雨味","basis":"结算单未列条码；以名称核心“羟基磷灰石牙膏”、唯一汇总数量238及尚未占用的唯一Excel SKU作一对一映射。","confidence":"medium"},"notes":["Excel明细（Sheet1，期间均为“5.1-5.20”，销售单价均为24.9）：第5行云朵饰品22；第17行红梅名妆48；第29行丽源名妆27；第41行米菲精品28；第53行桐贝美妆48；第65行时尚密码37；第77行大物集美28。确定性汇总数量238。","结算名称含“修复”，Excel名称未含该词；且结算单未打印条码，因此不标记为高置信度。"]},{"line_no":2,"product_name":"沸石净齿牙膏","quantity":275,"unit_reward":3,"reward_amount":825,"sales_match":{"barcode":"6970356162391","excel_product_name":"参半沸石净齿牙膏140g清新苍兰","basis":"结算单未列条码；名称核心“沸石净齿牙膏”完整出现在Excel名称中，且唯一汇总数量275与结算数量一致，作一对一映射。","confidence":"medium"},"notes":["Excel明细（Sheet1，期间均为“5.1-5.20”，销售单价均为29.9）：第6行云朵饰品48；第18行红梅名妆28；第30行丽源名妆33；第42行米菲精品32；第54行桐贝美妆48；第66行时尚密码49；第78行大物集美37。确定性汇总数量275。","Excel名称另含规格/香型“140g清新苍兰”；结算单未打印条码，因此不标记为高置信度。"]},{"line_no":3,"product_name":"沸石美白牙膏","quantity":284,"unit_reward":3,"reward_amount":852,"sales_match":{"barcode":"6970356162810","excel_product_name":"参半沸石美白牙膏140g海角雏菊","basis":"结算单未列条码；名称核心“沸石美白牙膏”完整出现在Excel名称中，且唯一汇总数量284与结算数量一致，作一对一映射。","confidence":"medium"},"notes":["Excel明细（Sheet1，期间均为“5.1-5.20”，销售单价均为29.9）：第7行云朵饰品60；第19行红梅名妆36；第31行丽源名妆36；第43行米菲精品28；第55行桐贝美妆47；第67行时尚密码33；第79行大物集美44。确定性汇总数量284。","Excel名称另含规格/香型“140g海角雏菊”；结算单未打印条码，因此不标记为高置信度。"]},{"line_no":4,"product_name":"1+2臻白套盒","quantity":226,"unit_reward":3,"reward_amount":678,"sales_match":{"barcode":"6970356164388","excel_product_name":"参半臻白牙膏1+2特享装","basis":"结算单未列条码；以唯一标识组合“1+2”与“臻白”、唯一汇总数量226及尚未占用的SKU作一对一映射。","confidence":"medium"},"notes":["Excel明细（Sheet1，期间均为“5.1-5.20”，销售单价均为29.9）：第2行云朵饰品44；第14行红梅名妆42；第26行丽源名妆18；第38行米菲精品44；第50行桐贝美妆36；第62行时尚密码24；第74行大物集美18。确定性汇总数量226。","结算称“套盒”，Excel称“牙膏1+2特享装”；措辞并非完全相同且结算单未打印条码，因此不标记为高置信度。"]},{"line_no":5,"product_name":"光白酵素1+1超值装牙膏","quantity":225,"unit_reward":3,"reward_amount":675,"sales_match":{"barcode":"6970356164395","excel_product_name":"参半极光白酵素1+1超值装牙膏(极光白160g+龙井100g)","basis":"结算单未列条码；名称核心“光白酵素1+1超值装牙膏”出现在唯一Excel名称中，且唯一汇总数量225与结算数量一致，作一对一映射。","confidence":"medium"},"notes":["Excel明细（Sheet1，期间均为“5.1-5.20”，销售单价均为19.9）：第8行云朵饰品28；第20行红梅名妆42；第32行丽源名妆46；第44行米菲精品24；第56行桐贝美妆25；第68行时尚密码36；第80行大物集美24。确定性汇总数量225。","Excel名称前有“极”并另含组合规格；结算单未打印条码，因此不标记为高置信度。"]},{"line_no":6,"product_name":"可益白牙膏葡萄知梨牙膏","quantity":252,"unit_reward":3,"reward_amount":756,"sales_match":{"barcode":"6970356169338","excel_product_name":"参半可益白牙膏葡萄知梨120g","basis":"结算单未列条码；名称核心“可益白牙膏葡萄知梨”对应唯一Excel名称，且唯一汇总数量252与结算数量一致，作一对一映射。","confidence":"medium"},"notes":["Excel明细（Sheet1，期间均为“5.1-5.20”，销售单价均为29.9）：第10行云朵饰品18；第22行红梅名妆36；第34行丽源名妆36；第46行米菲精品48；第58行桐贝美妆36；第70行时尚密码36；第82行大物集美42。确定性汇总数量252。","结算名称末尾重复“牙膏”，Excel名称另含120g；结算单未打印条码，因此不标记为高置信度。"]},{"line_no":7,"product_name":"可益清牙膏葡见茶爽牙膏","quantity":239,"unit_reward":3,"reward_amount":717,"sales_match":{"barcode":"6970356169321","excel_product_name":"参半可益清牙膏葡见茶爽120g","basis":"结算单未列条码；名称核心“可益清牙膏葡见茶爽”对应唯一Excel名称，且唯一汇总数量239与结算数量一致，作一对一映射。","confidence":"medium"},"notes":["Excel明细（Sheet1，期间均为“5.1-5.20”，销售单价均为29.9）：第11行云朵饰品24；第23行红梅名妆37；第35行丽源名妆28；第47行米菲精品48；第59行桐贝美妆29；第71行时尚密码44；第83行大物集美29。确定性汇总数量239。","结算名称末尾重复“牙膏”，Excel名称另含120g；结算单未打印条码，因此不标记为高置信度。"]},{"line_no":8,"product_name":"专研清新美白牙膏","quantity":278,"unit_reward":3,"reward_amount":834,"sales_match":{"barcode":"6970356162636","excel_product_name":"参半专研清新美白牙膏100g","basis":"结算单未列条码；名称核心“专研清新美白牙膏”完整出现在Excel名称中，且唯一汇总数量278与结算数量一致，作一对一映射。","confidence":"medium"},"notes":["Excel明细（Sheet1，期间均为“5.1-5.20”，销售单价均为29.9）：第9行云朵饰品18；第21行红梅名妆36；第33行丽源名妆48；第45行米菲精品26；第57行桐贝美妆60；第69行时尚密码54；第81行大物集美36。确定性汇总数量278。","Excel名称另含100g；结算单未打印条码，因此不标记为高置信度。"]},{"line_no":9,"product_name":"SP-4美白牙膏","quantity":190,"unit_reward":3,"reward_amount":570,"sales_match":{"barcode":"6970356164289","excel_product_name":"参半美白牙膏120g香域茉莉味","basis":"结算单未列条码；保留未在Excel名称中出现的“SP-4”为未核实系列称谓，以名称核心“美白牙膏”、唯一汇总数量190及尚未占用的SKU作一对一映射。","confidence":"medium"},"notes":["Excel明细（Sheet1，期间均为“5.1-5.20”，销售单价均为29.9）：第4行云朵饰品36；第16行红梅名妆24；第28行丽源名妆24；第40行米菲精品24；第52行桐贝美妆18；第64行时尚密码28；第76行大物集美36。确定性汇总数量190。","“SP-4”别称未在Excel中独立验证；结算单未打印条码，因此不标记为高置信度。"]},{"line_no":10,"product_name":"SP-4清新牙膏","quantity":244,"unit_reward":3,"reward_amount":732,"sales_match":{"barcode":"6970356164296","excel_product_name":"参半清新牙膏120g动感薄荷","basis":"结算单未列条码；保留未在Excel名称中出现的“SP-4”为未核实系列称谓，以名称核心“清新牙膏”、唯一汇总数量244及尚未占用的SKU作一对一映射。","confidence":"medium"},"notes":["Excel明细（Sheet1，期间均为“5.1-5.20”，销售单价均为29.9）：第3行云朵饰品47；第15行红梅名妆23；第27行丽源名妆48；第39行米菲精品36；第51行桐贝美妆18；第63行时尚密码24；第75行大物集美48。确定性汇总数量244。","“SP-4”别称未在Excel中独立验证；结算单未打印条码，因此不标记为高置信度。"]}]},"transfers":[{"transfer_id":"TR-IMG1-1035","amount":1035,"occurrence_count":2,"identity_visible":false,"event_date_visible":false,"store_name":null,"recipient_name":null,"transfer_date":null,"source_files":["雨瑶人员激励红包图片.jpg"],"dedup_basis":"同一截图内可见一条右侧“¥1035.00/已被接收”和一条左侧“¥1035.00/已收款”；按相同金额、相对顺序及互补状态作为同一转账的两处可见记录，保留出现次数2。未见交易单号，配对存在来源限制。","notes":["聊天页标题仅为“业务团队”，未显示具体门店或收款人姓名。","仅见“星期四 17:17”、消息时间10:45和手机状态栏10:46，未见完整年月日、交易单号或收款账户；这些时间值不作为转账日期。"]},{"transfer_id":"TR-IMG1-1056","amount":1056,"occurrence_count":2,"identity_visible":false,"event_date_visible":false,"store_name":null,"recipient_name":null,"transfer_date":null,"source_files":["雨瑶人员激励红包图片.jpg"],"dedup_basis":"同一截图内可见一条右侧“¥1056.00/已被接收”和一条左侧“¥1056.00/已收款”；按相同金额、相对顺序及互补状态作为同一转账的两处可见记录，保留出现次数2。未见交易单号，配对存在来源限制。","notes":["聊天页标题仅为“业务团队”，未显示具体门店或收款人姓名。","仅见“星期四 17:17”、消息时间10:45和手机状态栏10:46，未见完整年月日、交易单号或收款账户；这些时间值不作为转账日期。"]},{"transfer_id":"TR-IMG1-1032","amount":1032,"occurrence_count":2,"identity_visible":false,"event_date_visible":false,"store_name":null,"recipient_name":null,"transfer_date":null,"source_files":["雨瑶人员激励红包图片.jpg"],"dedup_basis":"同一截图内可见一条右侧“¥1032.00/已被接收”和一条左侧“¥1032.00/已收款”；按相同金额、相对顺序及互补状态作为同一转账的两处可见记录，保留出现次数2。未见交易单号，配对存在来源限制。","notes":["聊天页标题仅为“业务团队”，未显示具体门店或收款人姓名。","仅见“星期四 17:17”、消息时间10:45和手机状态栏10:46，未见完整年月日、交易单号或收款账户；这些时间值不作为转账日期。"]},{"transfer_id":"TR-IMG2-1014","amount":1014,"occurrence_count":2,"identity_visible":true,"event_date_visible":false,"store_name":null,"recipient_name":"闫志文","transfer_date":null,"source_files":["雨瑶人员激励红包图片2.jpg"],"dedup_basis":"同一截图内可见一条右侧“¥1014.00/已被接收”和一条左侧“¥1014.00/已收款”；按相同金额及互补状态作为同一转账的两处可见记录，保留出现次数2。未见交易单号，配对存在来源限制。","notes":["聊天页标题可见“同事 市场部 闫志文”，仅据此提取聊天对象姓名“闫志文”；气泡未显示门店名称、收款账户或交易单号。","仅见手机状态栏时间10:54，未见完整年月日，因此不提取转账日期。"]},{"transfer_id":"TR-IMG2-1095-A","amount":1095,"occurrence_count":2,"identity_visible":true,"event_date_visible":false,"store_name":null,"recipient_name":"闫志文","transfer_date":null,"source_files":["雨瑶人员激励红包图片2.jpg"],"dedup_basis":"截图中右侧有2条“¥1095.00/已被接收”，左侧有2条¥1095.00金额记录（1条完整显示“已收款”，另1条在底部被裁切但金额可见）；保留为2笔不同的¥1095.00转账，并按数量配对为每笔2次可见。因同额且无交易单号，A/B的具体镜像对应关系无法区分。","notes":["聊天页标题可见“同事 市场部 闫志文”，仅据此提取聊天对象姓名“闫志文”；气泡未显示门店名称、收款账户或交易单号。","仅见手机状态栏时间10:54，未见完整年月日，因此不提取转账日期。","本记录是两笔同额¥1095.00中的第一笔逻辑记录；与第二笔的具体镜像配对顺序不确定。"]},{"transfer_id":"TR-IMG2-1095-B","amount":1095,"occurrence_count":2,"identity_visible":true,"event_date_visible":false,"store_name":null,"recipient_name":"闫志文","transfer_date":null,"source_files":["雨瑶人员激励红包图片2.jpg"],"dedup_basis":"截图中右侧有2条“¥1095.00/已被接收”，左侧有2条¥1095.00金额记录（1条完整显示“已收款”，另1条在底部被裁切但金额可见）；保留为2笔不同的¥1095.00转账，并按数量配对为每笔2次可见。因同额且无交易单号，A/B的具体镜像对应关系无法区分。","notes":["聊天页标题可见“同事 市场部 闫志文”，仅据此提取聊天对象姓名“闫志文”；气泡未显示门店名称、收款账户或交易单号。","仅见手机状态栏时间10:54，未见完整年月日，因此不提取转账日期。","本记录是两笔同额¥1095.00中的第二笔逻辑记录；与第一笔的具体镜像配对顺序不确定，且左侧该次出现的状态文字被底部裁切。"]},{"transfer_id":"TR-IMG2-1026","amount":1026,"occurrence_count":2,"identity_visible":true,"event_date_visible":false,"store_name":null,"recipient_name":"闫志文","transfer_date":null,"source_files":["雨瑶人员激励红包图片2.jpg"],"dedup_basis":"同一截图内可见一条右侧“¥1026.00/已被接收”和一条左侧“¥1026.00/已收款”；按相同金额及互补状态作为同一转账的两处可见记录，保留出现次数2。未见交易单号，配对存在来源限制。","notes":["聊天页标题可见“同事 市场部 闫志文”，仅据此提取聊天对象姓名“闫志文”；气泡未显示门店名称、收款账户或交易单号。","仅见手机状态栏时间10:54，未见完整年月日，因此不提取转账日期。"]}],"extraction_notes":["已检查case.json列出的全部4个源文件：雨瑶人员激励参半销售数据2.xlsx、郑州雨瑶5.1-5.20人员激励活动结算单.jpg、雨瑶人员激励红包图片.jpg、雨瑶人员激励红包图片2.jpg。未编辑源证据。","Excel工作簿仅含Sheet1，使用区域84行×7列；识别70条有效销售明细，合计行、空行未作明细。所有有效明细的活动期间文本均为“5.1-5.20”，覆盖7家门店、10个唯一条码；每个条码仅映射一个结算行。","SHA-256：郑州雨瑶5.1-5.20人员激励活动结算单.jpg=898a8061a91af8d681ccdb650b43a07a42b96272407ba249dd64dc53b4bbc4e6；雨瑶人员激励参半销售数据2.xlsx=5e1ac08e1c79fd721e2f0dcf60e09763452943309163bb2079e424b77837b5a6；雨瑶人员激励红包图片.jpg=8aeda7f356dcf9123086cb55e6e60b4fc2049bfeaf784513dffcffa6f15b2529；雨瑶人员激励红包图片2.jpg=de4aa8f6d75027e207571fcf365ed5d805a350ff7622b45f29bc7d803db8c8ca。哈希仅固定本次读取的文件字节，不证明文件从未被修改。","64位整图pHash：结算单=d5f1828fc49e9332；红包图片1=872ef460ead5ea41；红包图片2=870ef568ea55aa51。两张红包截图的pHash汉明距离为6，只作为共同版式/背景的复核线索，未用于合并两张源文件或证明真实性。","3张JPEG均无EXIF条目，未取得可信GPS、设备或拍摄时间；截图中的手机时钟/星期标签不作为交易日期。截图未显示可核验的交易单号，且不提供原始转账详情或门店映射。","转账去重仅依据截图内相同金额序列、左右气泡和“已被接收/已收款”互补状态；每笔保留2次可见出现。两笔¥1095.00按数量保留为两笔不同转账，但具体镜像配对因同额、裁切和无交易单号而不确定。","本JSON仅包含提取事实、条码映射及证据限制；未计算最终支持金额、建议审批金额或审计结论。"]}